,end_date,start_date,subtitle,supporters,text,title,page
60,05. september 2018,09. marts 2018,"I dag er vi alle tvunget, til at have vores nem-konto i en privat bank. Dog kan vi selv vælge hvilken bank, men vilkårene er næsten de samme.Vi vil adskille bankforretning og spekulation, så befolkningen har et alternativ, og ikke er tvunget til at risikere et tab af midler pga. bankernes spekulation. Vi mener, at befolkningen har krav på et ”gratis” alternativ til deres nem-konto. En konto uden renter og gebyrer. Det digitaliserede samfund kræver, at vi har en nem-konto. Derfor skal der selvfølgelig også være et ""gratis"" alternativ.En folkeejet statsbank!”Banken” behøver udelukkende at være digital, hvor alle cpr-numre/cvr-numre kan have deres nem-konto, med netbank, med log-in via nem-id. Der skal selvfølgelig også laves løsninger på kontantindbetalinger, så virksomheder også finder skiftet nemt og godt. Dette kan administreres af finansministeriet. Her skal det være muligt, at være kunde som privat person, forening, virksomhed osv.Det skal forbydes ved lov, at masse-overvåge befolkningens købemønstre på nogen måde!Den folkeejede statsbank bør omfatte: Nem-konto, netbank, pensionsopsparing, børneopsparing, betalingsservice og fysiske hævekort, hvis kunden ønsker dette.Hvis de private banker ikke vil samarbejde med statsbankens bankkort, opsættes hæveautomater til kontante ind- og udbetalinger.- Eller vedtage et kontant-samarbejde ved lov.Alle services skal være ”gratis” for alle kunder, som kan være alle danske cpr-numre og cvr-numre.Det digitale samfund udfaser kontanter. Statsbanken skal garantere, at man altid kan hæve kontanter.Statsbanken skal fritages for gebyrer til Nets, da der kun er kunderne til at betale, og denne udgift ikke skal lægges over på skatten. Nets' monopol bør flyttes til Statsbanken, så en privat virksomhed ikke tjener milliarder på elektroniske overførsler. En evt. indkomst på dette, bør tilfalde Statsbanken, og komme kunderne/borgerne til gode.",769,"- Som banksystemet er nu, ligger størstedelen af bankernes arbejde i spekulation. - Private banker skaber de digitale penge, når de opretter lån til befolkningen.- Banken stiller en fysisk værdi som sikkerhed, men dette beløb ligger kun på omkring 10% af deres udlån.- Banken kræver renter af de nyoprettede lån. Penge som banken selv har skabt digitalt.- Denne model hedder ”Fractional reserve banking”, og bruges i hele verden.- De private banker styrer pengemængden (inflation og deflation).Statsbanken vil sørge for et åbent og ærligt banksystem, til glæde for alle kunderne i banken.Vi ser dette initiativ, som en løsning på mange fremtidige problemer. Vi håber, at i ligeledes synes om idéen, og håber, at i vil hjælpe, med at sprede budskabet, og omtale det i alle relevante samtaler/debatter.Danmark har brug for en folkeejet statsbank!For mere info, anbefaler vi jer, at søge på f.eks: ""Fractional reserve banking"" og ""Pengeskabelsen"".For mere info om Nets' monopol-lignende forhold, se DR's program ""So Ein Ding - Mobilbetaling""",Et statsligt alternativ til de private banker - en Statsbank,00449
61,29. august 2018,02. marts 2018,"Vi ønsker at indføre et forbud mod kritikken af den danske folkekirke, der næsten altid er baseret på et uoplyst grundlag. Denne kritik ser man for ofte i de landsdækkende medier.",8,"De seneste par år er der sket en markant stigning i udmeldelser af folkekirken. Hovedårsagen til dette er uoplyste religionskritiske stemmer, der er bragt i diverse landsdækkende medier.Vi stiller dette forslag for at forbyde denne hetz mod vores alle sammens folkekirke, som trækker tråde hele vejen tilbage til Harald Blåtand. Folkekirken er så stor en kulturel faktor i vores land, at vi ikke må lade den gå til grunde på et ikke-videnskabeligt, uoplyst og subjektivt grundlag.Hvis vi ikke står sammen mod denne farlige udvikling, hen imod folkekirkens opløsning, vil Danmark ikke være til at genkende længere. Vi vil miste en vigtig del af vores kulturarv, vores gode, solide, kristne værdier og en del af vor danskhed. Ydermere har vi i Danmark religionsfrihed. En så vigtig menneskeret må ikke knægtes af denne kritik og derfor er der et stort behov for dette forslag.Enten skal dette forslag stemmes igennem, ellers må folketingspolitikerne begynde at se på muligheden for at genindføre blasfemiparagraffen. Selvfølgelig med større beføjelser end før.",Forbyd kritik af folkekirken,00455
62,25. august 2018,26. februar 2018,"Hjerter Dame.Denne politiske lovændring til høring i folketinget skal sikre pædofiles overgreb, og forsøg på overgreb mod mindre årige.Lovforslagene:Hvis man dømmes for pædofili, eller anden straf mod mindre årige, skal den forurettet tilkendes en erstatning vurderet af en dommer efter sagens omstændigheder og sagens karakter/alvor, og den dømte skal tvang steriliseres, så man på denne måde bremser, hindrer eller nedsætter deres seksuelle indre drive, lyster og liderlighed, og livslang behandling for at hindrer fremtidige lyster.Der skal på alle chat rooms oprettes en profil, således at hvis man føler sig krænket, finder noget stødende, bliver tilbudt noget af seksuel karakter, kan man finde brugeren af profilen. Dette vil give et mere sikkert og trygt miljø især de unge kan færdes i.",43,"På bag grund af en hel række udsendelser hvor mænd over 18 år, tager kontakt til yngre piger, vidende om deres alder, vidende om deres seksuelle umodenhed tager de kontakt/henvender sig til piger under den seksuelle lavalder, vidende om det er ulovligt, vidende om at holde det hemmeligt, vidende om at få de unge piger til at holde det hemmeligt.Dette foregår primært på nettet, på de sociale medier, selv i børne apps, hvor et barn trykker på en kat der gentager hvad du siger, sad der en pædofil bag og tog screen shots af små børn helt ned til 4-5 års alderen.Vi finder det alt for nemt for mænd over 18 år at komme i kontakt med meget unge pige på de forskellige chat rooms som feks omegle.com og chatroutte hvor man ikke skal have en profil, men bare kan chatte løs, og sende videoer af forskellige seksuelle aktiviteter. Vi lavede et forsøg med at udgive os som en 12 årig pige, og indenfor 5 minutter havde vi seksuelle samtaler kørende med en mand på 23 og en dreng på 16 år, som tilbød os forskellige seksuelle aktiviteter og fik billeder af deres kønsdele. Vi skrev gentagne gange "" jeg er kun 12 år, og har ikke den store erfaring"", men dette var ikke et problem for dem.Vi mener, at på baggrund af de mange sager, alvoren for den forurettede, som kan risikere at få hele sit liv ødelagt, de bliver krænket, de bliver svigtet på deres troværdighed, de skal leve med psykiske ar på sjælen, fysiske men efter seksuelt samleje, så derfor helt enkelt skal strafferammen udvides/ ændres.",HJERTER DAME vil ændrer loven ved seksuelle overgreb på mindreårige.,00456
63,08. september 2018,12. marts 2018,Lovforslagene:Gratis medicin til kroniske lidelser og ved længere varende sygdomsforløb.Gratis briller til alle ved behov.Gratis tandlæge til alle.,277,"Udvidet dækning af sygesikringen.Hvis man som dansk statsborger lider af en kronisk lidelse eller længere varende sygdomsforløb, udredt af læge eller speciel læge såvel fysisk som psykisk, skal alle udgifter i forbindelse med sygdomsforløbet dækkes af den offentlige sygesikring.Hvis man har fået en diagnose, som kræver medicinsk behandling, kan dette være temmelig kostbart, mange borgere ved ikke hvor de skal skaffe penge til deres dyre behandlinger, og nogen gange kan man være nød til at prioriterer medicinen fra, hvilket kan få alvorlige konsekvenser for deres sygdomsforløb.Dette er også gældende for briller, ved nedsat syn, ændres borgerens livskvalitet, og det er utrolig kostbart at få de rigtige briller, dette må mange undvære og enten leve med billige forkerte briller eller briller der ikke er justeret i forhold til synet eller helt undvære.Besøg hos tandlægen skal ligeledes være dækket af syge sikringen. Dårlige tænder giver smerter, dårligt selvværd, man lukker sig inde, det kan medføre andre alvorlige sygdomme som er startet ved dårlige tænder og tandkød. For rigtig mange danske statsborgere er tandlæge besøg/behandlinger så kostbart at man undlader.",UDVIDET DÆKNING AF SYGESIKRINGEN.,00457
64,08. september 2018,12. marts 2018,Alle pelsfarme skal være udfaset senest 1. Januar 2023 uden mulighed for genåbning eller opstart af ny pelsfarm.,774,"Det er hverken livsnødvendigt eller etisk korrekt at producere pels og det er på tide at Danmark hopper rigtigt ind i det 21. århundrede og lukker alle pelsfarme!Ingen dyr er mindre værd end andre. De dyr som der er i kløerne på pelsindustrien har lige så meget ret til et værdigt langt og kærligt liv som alle andre levende væsner på denne jord.Et land kan ikke kalde sig civiliseret når det udnytter dyr så groft som de bliver i denne industrien!Det dyr der primært anvendes til at lave pels ud af her i Danmark, er minken, som er et vildt dyr. De lever kummerlige og unaturlige liv i små metalburer der gør at de ingen mulighed har for at udføre deres naturlige adfærd, hvilket gør dem stresset og øger bl.a risikoen for at de udvikler stereotypisk adfærd og hvor de skambider hinanden og sig selv. Dokumentarfilm ”Pels”, der udkom i 2015, giver et godt indblik i hvor forfærdelige at forholdene er på mange minkfarme, og at trods regler og love, så bliver det alligevel skjult for myndighederne hvor dårligt dyrene behandles.Vi skal ikke se længere end mod norden hvor de i Norge er i gang med at lukke alle pelsfarme. Mange lande har igennem det sidste årti udfaset flere forskellige pelsfarme markant, og i lande som bl.a. Norge, England, Østrig, Kroatien har de lavet totalforbud.Det er skammeligt at tænke på at der i Danmark er ca. 1500 minkfarme og årligt bliver opfostret og dræbt ca. 16.3 millioner minke, alene for modens skyld!Flere og flere tager heldigvis afstand fra denne barbariske kolde industri, både alm. forbrugere og store modehuse. Nedgangen i salg af pels går støt nedad, men den lever ikke desto mindre stadig og det skal stoppes NU!Der er efterhånden blevet muligt at lave så fine alternativer at det kan være nær umuligt at se forskel fra den ægte vare og den fake, så pels-entusiaster behøver ikke at være bekymret, det er ren hysteri hvis de nægter at tage alternativerne til sig. Dyrene skal ikke betale prisen for menneskers forfængelighed!Vi har allerede et forbud mod rævefarme i Danmark, det er på tide at vi går hele vejen nu!Pelsfarmenes dage er talte, vær nu med til at sætte punktummet for dem!",Alle pelsfarme skal lukkes i Danmark,00461
65,08. september 2018,12. marts 2018,"""Det skal ikke være lovligt at importere pels fra dyr til Danmark, hverken som privat eller virksomhed.”""Det skal ikke være lovligt for virksomheder eller private at sælge pels fra dyr i Danmark""",388,"Det er på tide at Danmark sætter foden ned og siger fra overfor alt pelshandel! Det skal ikke være lovligt at importere pels til Danmark, da det blot vil være at støtte den forfærdelige pelsindustri igennem andre lande hvor forholdene på ingen måde er bedre, tværtimod, så er forholdene markant værre flere steder bl.a. i dele af asien, hvor meget pels desværre kommer fra.Ingen dyr er mindre værd end andre, og de stakkels dyr der er fanget i pelsdyrindustrien har lige så meget ret til et værdigt langt og kærligt liv som alle andre levende væsner på denne jord.Mange pelsdyr er også vilde dyr der på ingen måde kan tilpasse sig et liv i fangenskab. De bliver ofte sindssyge og udvikler stereotypisk adfærd og skambider sig selv og hinanden pga. stress og kedsomhed. Den nye dokumentarfilm ”Pels”, der udkom i 2015, giver et godt indblik i hvor forfærdelige at forholdene er på mange minkfarme, og at trods regler og love, så bliver det alligevel skjult for myndighederne hvor dårligt dyrene behandles.Vi skal ikke se længere end til Norge, hvor de lige nu er i gang med at lukke alle pelsfarme. Mange lande, bl.a. 14 EU lande, har igennem de sidste årtier udfaset deres pelsfarme markant, og i lande som bl.a. Norge (skal være udfaset senest 2025), England (2000), Østrig (2004), Kroatien (2007), Slovenien (2013), Bosnien Hercegovina , Serbien, Makedonien, Holland (2012), Tjekkiet (2017) og Japan (2016) har de lavet totalforbud.Belgien, Tyskland og Luxenborg er igang med at finde frem til et totalforbud.I Indien blev det i Januar 2017 forbudt at importere mink, ræv og chinchilla pels. Israel lavede et totaltforbud mod salg af alt pels i 2017. I 2015 gjorde Sao Paola det samme og i West Hollywood lavede de et totalforbud om salg af alt pels, det trådte i kraft i 2013.Dette viser at mange andre lande tager stærkt afstand fra ikke kun pelsfarme i eget land, men også fra pelshandel i sig selv. Det kan ikke være rigtigt at vi i Danmark, et land der boltrer sig af at være et velfærdssamfund, når det kommer til både dyr og mennesker, ikke endnu har lavet et totalforbud!Skal vi se rent lovgivningsmæssigt på det, så er det forbudt at sælge pels fra hunde og katte i EU, da de dyr går ind under kategorien ""kæledyr"", men fakta er at megen pels der kommer fra bl.a. Kina er pels fra netop hunde og katte, men de sælges under dække og påstår at de er fra bl.a. kaniner, så de kan sælges i EU.Der er set utallige eksempler på hvor man har fundet ud af at pelsen ikke har været fra det dyr det blev angivet som at være fra. Der er endda også set flere tilfælde hvor en pels er angivet som at være syntetisk, men i virkeligheden har været ægte og fra hunde og katte.Dette viser at det er nær umuligt at kontrollere oprindelsen af alt pels, og dermed burde der allerede NU være et forbud mod alt import, da det ellers er en lovovertrædelse hver gang det viser sig at være pels fra hunde og katte! Flere og flere tager heldigvis afstand fra denne barbariske kolde industri, både alm. forbrugere og store modehuse. Nedgangen i salg af pels går støt nedad, men den lever stadig og det skal stoppes NU. Det er efterhånden også blevet muligt at lave så fine alternativer at det kan være nær umuligt at se forskel fra den ægte vare og den fake, så pels-entusiastisk behøver ikke at være bekymret, det er ren hysteri hvis de nægter at tage alternativerne til sig. Dyrene skal ikke betale prisen for menneskers forfængelighed!Et land kan ikke kalde sig civiliseret når det udnytter dyr så groft som de bliver i denne industri og Danmark bør vise sig som et godt eksempel nu overfor andre lande, ved at tage føretrøjen på og forbyde ALT pelshandel!Kom så Danmark!",Forbyde alt salg og import af pels fra dyr,00462
66,25. august 2018,26. februar 2018,"Hvorfor ønskes ændringen?De nuværende paragraffer giver Bopælsforælder frie hænder til at tage drastiske beslutninger omkring barnets bopælsforhold, selv når der er fælles forældremyndighed.Dette ender i mange tilfælde i unødvendig konflikt mellem forældrene, der kan være til stor skade for barnet.Forældreansvarslovens § 3, stk. 1 siger følgende:Har forældre fælles forældremyndighed, kræver væsentlige beslutninger vedrørende barnets forhold enighed mellem forældrene. Den forælder, som barnet har bopæl hos, kan træffe afgørelse om overordnede forhold i barnets daglige liv, herunder hvor i landet bopælen skal være.Forældreansvarslovens § 18 siger følgende:En forælder, der vil ændre sin eller barnets bopæl til et andet sted her i landet eller i udlandet, skal underrette den anden forælder herom senest 6 uger før flytningen.Vi stiller følgende ændringsforslag:Forældreansvarslovens § 3, stk. 1 - ændringsforslag:Har forældre fælles forældremyndighed, kræver væsentlige beslutninger vedrørende barnets forhold enighed mellem forældrene. Den forælder, som barnet har bopæl hos, kan træffe afgørelse om overordnede forhold i barnets daglige liv, herunder bopæl så længe det er i en radius af 15 kilometer til samværsforælder. Såfremt Bopælsforælder ønsker at flytte bopælen længere væk overgår bopælen til Samværsforælder, medmindre der er enighed mellem forældrene. Kan der ikke opnås enighed, kan Bopælsforælder søge sagen afgjort i retten.Forældreansvarslovens §18 - ændringsforslag:En forælder, der vil ændre sin eller barnets bopæl til et andet sted her i landet eller udlandet, der er længere væk end 15 km fra Samværsforælder, skal have Samværsforælders skriftlige samtykke. Såfremt Samværsforælder ikke giver samtykke, kan Bopælsforælder søge rettens afgørelse for flytningen.",139,"Hvad er fordelene ved de nye forslag?Med en ændring af § 3, stk. 1 og § 18 således at Bopælsforælder bliver pålagt at skulle ansøge om at få tilladelse til at flytte, giver dette flere fordele.Loven vil opfordre til, at Bopælsforælder og Samværsforælder skal forsøge at opnå enighed, dermed fordrer disse ændringer samarbejde i større grad. Ydermere bliver det pålagt Bopælsforælder at søge enighed, da det er denne, der ønsker at gennemføre den drastiske ændring overfor barnet. Og det vil ikke længere være muligt for Bopælsforælder at flytte til den anden ende af landet og blot skulle give 6 ugers varsel.Dermed vil det være den part, der vil ændre omstændighederne omkring barnet, der skal søge rettens afgørelse, hvis der ikke kan opnås enighed mellem forældrene. Retssystemet vil kunne se med fornuftige øjne på ansøgningen, og de forhold der bliver lagt til grund af Bopælsforælder for den drastiske ændring omkring barnets base og relation til nærområdet. Det vil medvirke til, at Retten bedre kan vurdere, hvad der vil være til Barnets bedste, og det øger chancen for at barnets bedste tilgodeses, og at barnet modtager en langt mere fair vurdering af omstændighederne og konsekvenserne.","Ændring af Forældreansvarslovens § 3, stk. 1 og § 18.For at give børn bedre muligheder når forældrene skilles. Barnets bedste #fairforalle",00476
67,08. september 2018,12. marts 2018,Forbyd alle reklamer for spil på tv og radio.,446,"Se nu bare hvor mange ludomaner vi har i Danmark. Der kommer flere og flere behandlingshjem for ludomani. Det ødelægger for meget for for mange mennesker der ikke kan styre det. Og samtidig kommer der flere udbydere af spil, og det bliver for let tilgængeligt",Forbyd reklamer for spil,00479
68,11. september 2018,15. marts 2018,Der skal rettes op på den skævhed med manglende fremskrivning af folkepensionen. I fremtiden skal folkepensionen fremskrives 100%.Midlerne til satspuljnerne skal fremover finaiseres af finasloven.,231,Det er urimeligt at folkepensionerne foringes år efter år. Det betyder at købekraften af folepensionen foringes. Som pensionist ser vi forsikringer og alle afgifter til vand og andre kommunale udgifter stiger med pristallet. Det gælder også TV licens osv.Overenskomst forhandlingerne munder altid ud i en minimum stigning med pristallet.Ved gennemførsel af dette sikre man at folkepensionister som minumum har samme købekraft.,Folkepensionisters købekraft skal sikres.,00485
69,15. september 2018,19. marts 2018,Jernbane loven §33 og generelt ekspropriation samt erstatning skal gøres mere lempelig så den enkelte borger ikke bliver økonomisk eller følelsesmæssig mere belastede end højst nødvendigt.,181,"Borgere der kan dokumentere at de bliver væsentligt berørt både økonomisk og følelsesmæssig af infrastruktur planer som eksempelvis en jernbane eller motorvej bør uden tøven blive tilbudt forlods overtagelse og skal ikke være stavnsbundet.Især jernbane loven §33 som vejdirektoratet tolker som vinden blæser , skal gøres mere lempelig så den beskytter berørte borgere og ikke kaster dem ud i en økonomisk ruin. Der skal være regler for hvor meget dB. man må acceptere, stigende støjgener fra motorvej og jernbane skader helbredet og borgere der er bleven påført stigende gener pga. den samfundsmæssige udvikling skal tilbydes erstatning eller ekspropriation.",Ekspropriation og erstatning,00494
70,15. september 2018,19. marts 2018,Vi må afskaffer alle regler om gensidig forsørgerpligt således at en person uanset om de er gift eller ej altid kan modtage kontanthjælp uanset hvad deres partner eventuelt måtte tjene.,569,Det skal kunne betale sig at arbejde. Derfor må og skal vi afskaffe gensidig forsørgerpligt.Som det er i dag hvis man er gift med en på kontanthjælp så kan det ikke betale sig at tage et job så længe at man ikke kommer op og tjener ca det dobbelte kontanthjælp. Det er de færreste arbejdsløse der er i stand til at tjene så meget.Det skade samfundet at holde flere fastlåst i kontanthjælp eller dagpenge systemmet bare fordi de er gift med en anden på kontanthjælp.for eksempel vil de fleste lærestillinger være udelukket at søge som arbejsløs hvis man er gift med en som modtager kontanthjælp.,Afskaf Gensidig forsøgerpligt,00496
71,29. august 2018,02. marts 2018,"Lovforslag vedr. kommuners brug af ”Clean cut” ved ændring af et barns anbringelsessted:Med udgangspunkt i barnets tarv, er det nødvendigt at Folketinget træffer beslutning om, at ”Clean cut” kun kan anvendes i tilfælde, hvor der foreligger en begrundet mistanke og bekymring for, at det enkelte anbragte barn mistrives eller på anden vis udsættes for vanrøgt. Derfor foreslås følgende tilføjelse til lovgivningen:Når der i en forvaltning træffes afgørelse om ændring af et barns anbringelsessted, skal der - i de tilfælde, hvor ændringen ikke skyldes akut mistrivsel - foretages en børnefaglig vurdering af, hvordan barnets bedste, for det konkrete barn, sikres i forløbet frem mod den nye anbringelse, således at det sikres, at barnets overgang til et nyt værested sker på en måde, hvor det pågældende barn lider mindst muligt overlast og oplever færrest mulige svigt og opbrud i tilværelsen.Baggrund:Den 16.11.2017 redegør børne – og sundhedsministeren over for Folketinget for sit kendskab til ”Clean cut” samt anvendelsen heraf.Børne – og sundhedsministeren bekender i den forbindelse, at der ved ”Clean cut” refereres til kommunale afgørelser om, at et anbragt barn hjemgives eller flyttes fra ét anbringelsessted til et andet med meget kort varsel, eller afgørelser om, at samvær eller kontakt til det tidligere anbringelsessted helt afbrydes. Ministeren henviser desuden til, at ”Clean cut” ikke er et begreb, der findes i lovgivningen.Oprids:I tilfælde, hvor barnet er i trivsel og udvikling, kan en så drastisk og voldsom indgriben i barnets tilværelse, potentielt set være et overgreb på det enkelte barn, hvis det udsættes for ”Clean cut”.",136,"Jeg stiller forslaget, da jeg som plejemor har mærket på egen krop, vigtigheden af tydeligt definerede procedurer og dermed sikkerhed for barnets tarv, som ved ""Clean cut"" kan risikere skade for livet.I tilfælde, hvor der IKKE er tale om et barn i mistrivsel, bør man fra forvaltningens side forsøge, at opnå dialog med barnets primære omsorgspersoner - i mange tilfælde plejefamilien - om den bedst mulige overgang for barnet, så man sikrer, at der kan påbegyndes relationsdannelse til folk i det nye anbringelsessted og samtidig opnår, at få en god og fyldestgørende overlevering i forhold til det anbragte barns hverdag, herunder rutiner, sygdomme, aftaler osv.Alt dette for at sikre så få ændringer i barnets liv som muligt!",#StopcleancutstøtplejebørnsretLovforslag vedr. kommuners brug af ”Clean cut” ved ændring af et barns anbringelsessted.,00499
72,08. september 2018,12. marts 2018,Konkurrencekommisær Margrethe Vestager bør genudnævnes til konkurrencekommisær for en ny 5 årig periode.,140,"Vi er helt på det rene med at udnævnelse af EU-kommisærer ikke er et folketingsanliggende, men et anliggende for den aktuelle statsminister. Imidlertid tillader vi os at foreslå at Margrethe Vestager skal genudnævnes til konkurrencekommisær. Dette forslag er rettet til såvel den nuværende regering/statsminister som den eventuelle afløser. Situationen er kompliceret, idet en genudnævnelse af Margrethe Vestager skal foretages af et parti/statsminister, der ikke deler partibog med hende. Dette er således en appel til at folketing og regering alvorligt overvejer om man ikke i dette tilfælde skal se bort fra ""parti-egoisme"" og så udelukkende se på, hvordan Danmark bedst bidrager til et styrket EU. Indsats for et styrket EU angår Folketinget. Her taler Margrethe Vestagers helt enestående indsats for sig selv. Ligesom det forhold at netop det store arbejde med at sikre anstændige konkurrenceforhold kun kan løses over en længere periode - altså 10 år ialt.",5 ÅR MERE TIL MARGRETHE VESTAGER,00508
